english,tag,definition
check,verb,"1. to examine something to see if it is correct, safe or acceptable 2. to look at something or ask somebody to find out if something/somebody is present, correct or true or if something is how you think it is"
cheese,noun,1. a type of food made from milk that can be either soft or hard and is usually white or yellow in colour; a particular type of this food 2. what you ask somebody to say before you take their photograph
chicken,noun,1. a large bird that is often kept for its eggs or meat 2. meat from a chicken
child,noun,1. a young human who is not yet an adult 2. a son or daughter of any age
chocolate,noun,"1. a hard brown sweet food made from cocoa beans, used in cooking to add taste to cakes, etc. or eaten as a sweet 2. a sweet that is made of or covered with chocolate"
choose,verb,1. to decide which thing or person you want out of the ones that are available 2. to prefer or decide to do something
cinema,noun,"1. a building in which films are shown 2. when you go to the cinema or to the movies, you go to a cinema to see a film"
city,noun,"1. a large and important town 2. a town that has been given special rights by a king or queen, usually one that has a cathedral"
class,noun,1. a group of students who are taught together 2. an occasion when a group of students meets to be taught
classmate,noun,a person who is or was in the same class as you at school or college
classroom,noun,a room where a class of children or students is taught
clean,verb,1. to remove the dirt or dust from something 2. to become clean
clean,adjective,1. not dirty 2. having a clean appearance and living in clean conditions
climb,verb,1. to go up something towards the top 2. to go up mountains or climb rocks as a hobby or sport
clock,noun,"1. an instrument for measuring and showing time, in a room, on the wall of a building or on a computer screen (not worn or carried like a watch) 2. the milometer in a vehicle (= an instrument that measures the number of miles the vehicle has travelled)"
close,verb,close (something) to put something into a position so that it covers an opening; to get into this position
clothes,noun,"1. the things that you wear, such as trousers, dresses and jackets 2. used to describe a situation in which everybody suddenly realizes that they were wrong to believe that somebody/something was very good, important, etc."
club,noun,1. an organization for people who share an interest or do a sport or activity together 2. the building or rooms that a particular club uses
coat,noun,1. a piece of outdoor clothing that is worn over other clothes to keep warm or dry. Coats have sleeves (= parts covering the arms) and may be long or short. 2. a jacket that is worn as part of a suit
coffee,noun,1. the roasted seeds (called coffee beans) of a tropical bush; a powder made from them 2. a hot drink made from coffee powder and boiling water. It may be drunk with milk and/or sugar added.
cold,adjective,1. having a lower than usual temperature; having a temperature lower than the human body 2. not heated; cooled after being cooked
cold,noun,"1. a common illness that affects the nose and/or throat, making you cough, sneeze, etc. 2. a lack of heat or warm air; a low temperature, especially in the atmosphere"
college,noun,1. (in the UK) a place where students go to study or to receive training after they have left school 2. (in the US) a university where students can study for a degree after they have left school
color,verb,"1. to put color on something using paint, colored pencils, etc. 2. to become red because the person is embarrassed "
color,noun,"1. the appearance that things have that results from the way in which they reflect light. Red, orange and green are colors. 2. the use of all the colors, not only black and white"
colour,noun,"1. the appearance that things have that results from the way in which they reflect light. Red, orange and green are colours. 2. the use of all the colours, not only black and white"
come,verb,1. to move to or towards a person or place 2. to arrive at or reach a place
common,adjective,1. happening often; existing in large numbers or in many places 2. shared by or belonging to two or more people or by the people in a group
company,noun,1. a business organization that makes money by producing or selling goods or services 2. a group of people who work or perform together
compare,verb,"1. to examine people or things to see how they are similar and how they are different 2. to be similar to somebody/something else, either better or worse"
complete,adjective,"1. including all the parts, etc. that are necessary; whole 2. finished"
complete,verb,1. to finish making or doing something 2. to write all the information you are asked for on a form
computer,noun,"an electronic machine that can store, organize and find information, do processes with numbers and other data, and control other machines"
concert,noun,1. a public performance of music 2. working together with somebody/something
conversation,noun,an informal talk involving a small group of people or only two; the activity of talking in this way
cook,verb,"1. to prepare food by heating it, for example by boiling, baking or frying it 2. to be prepared by boiling, baking, frying, etc."
cooking,noun,1. the process of preparing food by heating it 2. food that has been prepared in a particular way
cool,adjective,1. fairly cold; not hot or warm 2. helping you keep cool
correct,verb,"1. to make something right or accurate, for example by changing it or removing mistakes 2. to mark the mistakes in a piece of work (and sometimes give a mark to the work)"
correct,adjective,"1. accurate or true, without any mistakes  2. right and suitable, so that something is done as it should be done"
cost,noun,"1. the amount of money that you need in order to buy, make or do something 2. the total amount of money that needs to be spent by a business"
cost,verb,"1. if something costs a particular amount of money, you need to pay that amount in order to buy, make or do it 2. to cause the loss of something"
could,verb,1. used as the past tense of ‘can’ 2. used to ask if you can do something
countable,adjective,"a noun that is countable can be used in the plural and with a or an, for example table, cat and idea"
country,noun,"1. an area of land that has or used to have its own government and laws 2. any area outside towns and cities, with fields, woods, farms, etc."
course,noun,1. a series of lessons or lectures on a particular subject 2. a period of study at a college or university that leads to an exam or a qualification
cousin,noun,1. a child of your aunt or uncle 2. a person who is in your wider family but who is not closely related to you
cow,noun,"1. a large animal kept on farms to produce milk or beef 2. the female of the elephant, whale and some other large animals"
cream,noun,"1. the thick white or pale yellow fatty liquid that rises to the top of milk, used in cooking or as a type of sauce to put on fruit, etc. 2. a sweet that has a soft substance like cream inside"
create,verb,1. to make something happen or exist 2. to produce a particular feeling or impression
culture,noun,"1. the customs and beliefs, art, way of life and social organization of a particular country or group 2. a country, group, etc. with its own beliefs, etc."
cup,noun,"1. a small container that is like a bowl in shape, usually with a handle, used for drinking tea, coffee, etc. 2. the contents of a cup"
customer,noun,1. a person or an organization that buys goods or services from a shop or business 2. used after an adjective to describe a particular type of person
cut,verb,"1. to make an opening or a wound in something, especially with a sharp tool such as a knife or scissors 2. to divide something into two or more pieces with a knife, etc."
dad,noun,"1. father 2. financial support from your parents, especially when you are an adult"
dance,verb,1. to move your body to the sound and rhythm of music 2. to do a particular type of dance
dance,noun,"1. a series of movements and steps that are usually performed to music; a particular example of these movements and steps 2. the art of dancing, especially for entertainment"
dancer,noun,a person who dances or whose job is dancing
dancing,noun,moving your body to music
dangerous,adjective,"1. likely to injure or harm somebody, or to damage or destroy something 2. likely to cause problems or have a bad result"
dark,adjective,"1. with no or very little light, especially because it is night 2. not light; closer in shade to black than to white"
date,noun,"1. a particular day of the month, sometimes in a particular year, given in numbers and words 2. a particular day or year when a particular event happened or will happen"
daughter,noun,"1. a person’s female child 2. a woman who belongs to a particular place or country, etc."
day,noun,1. a period of 24 hours 2. the time between when it becomes light in the morning and when it becomes dark in the evening
dear,adjective,1. used at the beginning of a letter before the name or title of the person that you are writing to 2. loved by or important to somebody
decide,verb,1. to think carefully about the different possibilities that are available and choose one of them 2. to make an official or legal judgement
delicious,adjective,1. having a very pleasant taste or smell 2. extremely pleasant
describe,verb,1. to say what somebody/something is like 2. to make a movement that has a particular shape; to form a particular shape
description,noun,"1. a piece of writing or speech that says what somebody/something is like; the act of writing or saying in words what somebody/something is like 2. of some, etc. type"
design,noun,"1. the general arrangement of the different parts of something that is made, such as a building, book, machine, etc. 2. the art or process of deciding how something will look, work, etc. by drawing plans, making computer models, etc."
design,verb,"1. to decide how something will look, work, etc., by drawing plans, making computer models, etc. 2. to think of and plan a system, a way of doing something, etc., usually for a particular purpose or use"
desk,noun,"1. a piece of furniture like a table, often with drawers (= parts like boxes in it with handles on the front for pulling them open), that you sit at to read, write, work, etc. 2. a place where you can get information or be served at an airport, a hotel, etc."
detail,noun,"1. a small individual fact or item; a less important fact or item 2. the small facts or features of something, when you consider them all together"
dialogue,noun,"1. a conversation in a book, play or film or in language teaching materials 2. a formal discussion between two groups or countries, especially when they are trying to solve a problem, end a disagreement, etc."
dictionary,noun,"1. a book or electronic resource that gives a list of the words of a language in alphabetical order and explains what they mean, or gives a word for them in a foreign language 2. a book that explains the words that are used in a particular subject"
die,verb,1. to stop living 2. to stop existing; to disappear
diet,noun,1. the food and drink that you eat and drink regularly 2. a limited variety or amount of food that you eat for medical reasons or because you want to lose weight; a time when you only eat this limited variety or amount
difference,noun,1. the way in which two people or things are not like each other; the way in which somebody/something has changed 2. the amount that something is greater or smaller than something else
different,adjective,1. not the same as somebody/something; not like somebody/something else 2. separate and individual
difficult,adjective,1. not easy; needing effort or skill to do or to understand 2. full of problems; causing a lot of trouble
dining,,the activity of eating a meal
dinner,noun,"1. the main meal of the day, eaten either in the middle of the day or in the evening 2. a large formal social gathering at which dinner is eaten"
dirty,adjective,1. not clean 2. connected with sex in an offensive way
discuss,verb,"1. to talk about something with somebody, especially in order to decide something 2. to write or talk about something in detail, showing the different ideas and opinions about it"
dish,noun,"1. a flat shallow container for cooking food in or serving it from 2. the plates, bowls, cups, etc. that have been used for a meal and need to be washed"
do,verb,ditto
doctor,noun,"1. a person who has been trained in medical science, whose job is to treat people who are ill or injured 2. a place where a doctor sees patients"
dog,noun,"1. an animal with four legs and a tail, often kept as a pet or trained for work, for example hunting or guarding buildings. There are many types of dog, some of which are wild. 2. a male dog, fox, wolf or otter"
dollar,noun,"1. the unit of money in the US, Canada, Australia and several other countries 2. the value of the US dollar compared with the value of the money of other countries"
door,noun,"1. a piece of wood, glass, etc. that is opened and closed so that people can get in and out of a room, building, car, etc.; a similar thing in a cupboard 2. the space when a door is open"
down,adverb,1. to or at a lower place or position 2. from a standing position to a sitting or lying position
down,preposition,1. from a high or higher point on something to a lower one 2. along; towards the direction in which you are facing
downstairs,adverb,"down the stairs; on or to a floor of a house or building lower than the one you are on, especially the one at ground level"
downstairs,noun,"the lower floor of a house or building, especially the one at ground level"
draw,verb,"1. to make pictures, or a picture of something, with a pencil, pen or chalk (but not paint) 2. to describe something in words in a way that produces an image in somebody's mind"
dress,verb,1. to put clothes on yourself/somebody 2. to wear a particular type or style of clothes
dress,noun,"1. a piece of clothing that is made in one piece and hangs down to cover the body as far as the legs, sometimes reaching to below the knees, or to the ankles 2. clothes of a particular type"
drink,noun,1. a liquid for drinking; an amount of a liquid that you drink 2. alcohol or an alcoholic drink; something that you drink on a social occasion
drink,verb,"1. to take liquid into your mouth and then down your throat into your stomach 2. to drink alcohol, especially when it is done regularly"
drive,verb,"1. to operate a vehicle so that it goes in a particular direction 2. to take somebody somewhere in a car, taxi, etc."
driver,noun,"1. a person who drives a vehicle 2. a club with a large head, used for hitting the ball long distances from the tee"
during,preposition,1. all through a period of time 2. at some point in a period of time
each,adverb,"1. used to refer to every one of two or more people or things, when you are thinking about them separately 2. every single one"
ear,noun,1. either of the organs on the sides of the head that you hear with 2. having the type of ears mentioned
early,adjective,"1. near the beginning of a period of time, an event etc. 2. arriving, or done before the usual, expected or planned time"
early,adverb,"1. near the beginning of a period of time, an event, a piece of work, etc. 2. before the usual, expected or planned time"
east,noun,"1. the direction that you look towards to see the sun rise; one of the four main points of the compass 2. the eastern part of a country, region or city"
east,adjective,1. in or towards the east 2. an east wind blows from the east
east,adverb,1. towards the east 2. nearer to the east than something
easy,adjective,"1. not difficult; done or obtained without a lot of effort or problems 2. comfortable, relaxed and not worried"
eat,verb,"1. to put food in your mouth, bite it and swallow it  2. to have a meal"
eating,noun,1. the act of eating something 2. you can only judge if something is good or bad when you have tried it
egg,noun,"1. a small oval object with a thin hard shell produced by a female bird and containing a young bird; a similar object (without a hard shell) produced by a female fish, insect, etc. 2. a bird’s egg, especially one from a chicken, that is eaten as food"
eight,,8
eighteen,,18
eighty,,80
elephant,noun,"1. a very large animal with thick grey skin, large ears, two curved outer teeth called tusks and a long nose called a trunk. There are two types of elephant, the African and the Asian. 2. a problem or question that everyone knows about but does not mention because it is easier not to discuss it"
eleven,,11
else,adverb,1. in addition to something already mentioned 2. different
email,noun,1. a way of sending messages and data to other people by means of computers connected together in a network 2. a message sent by email
email,verb,to send a message to somebody by email
end,noun,"1. the final part of a period of time, an event, an activity or a story 2. a situation in which something does not exist any more"
end,verb,1. to finish; to reach a point and go no further; to make something finish 2. to spend the last part of your life in a particular state or place
enjoy,verb,1. to get pleasure from something 2. to be happy and get pleasure from what you are doing
enough,adverb,used before plural or uncountable nouns to mean ‘as many or as much as somebody needs or wants’
euro,noun,1. the unit of money of some countries of the European Union 2. euros as a system of money; the value of the euro compared with the value of the money of other countries
even,adverb,"1. used to emphasize something unexpected or surprising 2. used when you are comparing things, to make the comparison stronger"
evening,noun,1. the part of the day between the afternoon and the time you go to bed 2. an event of a particular type happening in the evening
event,noun,"1. a thing that happens, especially something important 2. a planned public or social occasion"
ever,adverb,"1. used in negative sentences and questions, or sentences with if to mean ‘at any time’ 2. used for emphasis when you are comparing things"
every,,used with singular nouns to refer to all the members of a group of things or people
everybody,,every person; all people
everyone,,every person; all people
everything,,all things
exam,noun,"1. a formal written, spoken or practical test, especially at school or college, to see how much you know about a subject, or what you can do 2. a medical test of a particular part of the body"
example,noun,"1. something such as an object, a fact or a situation that shows, explains or supports what you say 2. a thing that is typical of or represents a particular group or set"
excited,adjective,1. feeling or showing happiness and enthusiasm 2. nervous or upset and unable to relax
exciting,adjective,causing great interest or excitement
exercise,noun,1. physical or mental activity that you do to stay healthy or become stronger 2. a set of movements or activities that you do to stay healthy or develop a skill
exercise,verb,1. to do sports or other physical activities in order to stay healthy or become stronger; to make an animal do this 2. to give a part of the body the movement and activity it needs to keep strong and healthy
expensive,adjective,costing a lot of money
explain,verb,"1. to tell somebody about something in a way that makes it easy to understand 2. to give a reason, or be a reason, for something"
extra,adjective,"1. more than is usual, expected, or than exists already 2. behaving in a way that is too dramatic or shows too much effort"
eye,noun,1. either of the two organs on the face that you see with 2. having the type or number of eyes mentioned
face,noun,"1. the front part of the head, where the eyes, nose and mouth are  2. an expression that is shown on somebody’s face"
fact,noun,"1. a thing that is known to be true, especially when it can be proved 2. things that are true rather than things that have been invented"
fall,verb,1. to drop down from a higher level to a lower level 2. to suddenly stop standing
false,adjective,1. wrong; not correct or true 2. not natural
family,noun,"1. a group consisting of one or two parents and their children 2. a group consisting of one or two parents, their children and close relations"
family,adjective,1. connected with the family or a particular family 2. owned by a family
famous,adjective,1. known about by many people 2. people who are known about by many people
fantastic,adjective,1. extremely good; excellent 2. very large; larger than you expected
far,adverb,1. a long distance away 2. used when you are asking or talking about the distance between two places or the distance that has been travelled or is to be travelled
farm,noun,"1. an area of land, and the buildings on it, used for growing crops and/or keeping animals 2. the main house on a farm, where the farmer lives"
farmer,noun,a person who owns or manages a farm
fast,adjective,1. moving or able to move quickly 2. happening in a short time or without delay
fast,adverb,1. quickly 2. in a short time; without delay
fat,adjective,1. having too much flesh on it and weighing too much 2. containing a lot of fat
father,noun,1. a male parent of a child or an animal; a person who is acting as the father to a child 2. a person’s ancestors (= people who are related to you who lived in the past)
favourite,noun,1. a person or thing that you like more than the others of the same type 2. a person who is liked better by somebody and receives better treatment than others
favourite,adjective,"1. liked more than others of the same kind 2. a performer, politician, sports player, etc., who is popular where they were born"
feel,verb,1. to experience a particular feeling or emotion 2. to notice or be aware of something because it is touching you or having a physical effect on you
feeling,noun,1. something that you feel through the mind or through the senses 2. a person’s emotions rather than their thoughts or ideas
festival,noun,"1. a series of performances of music, plays, films, etc., usually organized in the same place once a year; a series of public events connected with a particular activity or idea 2. a day or period of the year when people stop working to celebrate a special event, often a religious one"
few,adjective,"1. used with plural nouns and a plural verb to mean ‘a small number’, ‘some’ 2. used with plural nouns and a plural verb to mean ‘not many’"
fifteen,,15
fifth,,5th
fifty,,50
fill,verb,1. to make something full of something; to become full of something 2. to block a hole with a substance
film,noun,"1. a series of moving pictures recorded with sound that tells a story, watched at a cinema or on a television or other device 2. the art or business of making films"
final,adjective,"1. being or happening at the end of a series of events, actions, statements, etc. 2. being the result of a particular process"
find,verb,1. to discover somebody/something unexpectedly or by chance 2. to get back something/somebody that was lost after searching for it/them
fine,adjective,1. in good health 2. of high quality; good
finish,verb,1. to stop doing something or making something because it is complete 2. to come to an end; to bring something to an end
fire,noun,"1. the flames, light and heat, and often smoke, that are produced when something burns 2. flames that are out of control and destroy buildings, trees, etc."
first,adverb,happening or coming before all other similar things or people; 1st
fish,noun,"1. a creature that lives in water, breathes through gills, and uses fins and a tail for swimming 2. the soft part of fish that is eaten as food"
five,,5
flat,noun,"1. a set of rooms for living in, usually on one floor of a building 2. the flat level part of something"
flight,noun,"1. a journey made by air, especially in a plane 2. a plane making a particular journey"
floor,noun,1. the surface of a room that you walk on 2. the bottom surface of a vehicle
flower,noun,1. the coloured part of a plant from which the seed or fruit develops. Flowers usually grow at the end of a stem and last only a short time. 2. a plant grown or valued for the beauty of its flowers
fly,verb,"1. to move through the air, using wings 2. to move through air or space"
follow,verb,1. to come or go after or behind somebody/something 2. to come or go after or behind somebody in order to watch where they go and what they do
food,noun,1. things that people or animals eat 2. an idea that makes you think seriously and carefully
foot,noun,"1. the lowest part of the leg, below the ankle, on which a person or an animal stands 2. having or using the type or number of foot/feet mentioned"
football,noun,"1. a game played by two teams of 11 players, using a round ball that players kick up and down the playing field. Teams try to kick the ball into the other team’s goal. 2. a game played by two teams of 11 players, using an oval ball which players kick, throw, or carry. Teams try to put the ball over the other team’s line."
for,preposition,1. used to show who is intended to have or use something or where something is intended to be put 2. in order to help somebody/something
forget,verb,"1. to not remember to do something that you ought to do, or to bring or buy something that you ought to bring or buy 2. to be unable to remember something that has happened in the past or information that you knew in the past"
form,noun,"1. a type or variety of something 2. a way of writing or saying a word that shows, for example, if it is plural or in a particular tense"
