english,tag,definition
Africa,noun,the second largest continent
America,noun,one of several names for United States (of America) (1)
April,noun,"1. the fourth month of the year, between March and May 2. a first name for girls"
Asia,noun,the largest continent
association,noun,1. an official group of people who have joined together for a particular purpose 2. a connection or relationship between people or organizations
August,noun,"the 8th month of the year, between July and September"
CD,noun,"a small disc on which sound or information is recorded. CDs can be played or read on various types of machines, including CD players and computers. (the abbreviation for ‘compact disc’) "
Christmas,noun,"1. 25 December, the day when Christians celebrate the birth of Christ 2. the period that includes Christmas Day and the days close to it"
Coca-Cola,noun,a popular type of cola drink
DVD,noun,"a disk on which large amounts of information, especially films, photographs and video, can be stored, for use on a DVD player or computer (the abbreviation for ‘digital versatile disc’ or ‘digital videodisc’) "
December,noun,the 12th and last month of the year
English,noun,"1. the language, originally of England, now spoken in many other countries and used as a language of international communication throughout the world 2. English language or literature as a subject of study"
Europe,noun,"1. the continent next to Asia in the east, the Atlantic Ocean in the west, and the Mediterranean Sea in the south 2. the European Union"
February,noun,"the 2nd month of the year, between January and March"
French,noun,1. the language of France and some other countries 2. the people of France
Friday,noun,"1. the day of the week after Thursday and before Saturday 2. a character in Daniel Defoe's novel Robinson Crusoe. He becomes Crusoe's faithful servant after Crusoe saves him from being eaten by cannibals. The phrase Man Friday or Girl Friday was sometimes used to describe an assistant who did many different jobs in an office, but is now quite old-fashioned."
German,noun,"1. a person from Germany 2. the language of Germany, Austria and parts of Switzerland"
I,,used as the subject of a verb when the speaker or writer is referring to himself/herself
Italian,noun,1. a person from Italy 2. the language of Italy
January,noun,"the 1st month of the year, between December and February"
July,noun,"the 7th month of the year, between June and August"
June,noun,"1. the 6th month of the year, between May and July 2. a first name for girls"
March,noun,"1. an organized walk by many people from one place to another, in order to protest about something, or to express their opinions 2. an act of marching; a journey made by marching"
May,noun,the white or pink flowers of the hawthorn
Monday,noun,"the day of the week after Sunday and before Tuesday, the first day of the working week"
North,,the direction that is on your left when you watch the sun rise; one of the four main points of the compass
November,noun,"the 11th month of the year, between October and December"
OK,adverb,1. safe and well; in a calm or happy state 2. all right; acceptable; in an acceptable way
OK,adjective,1. safe and well; in a calm or happy state 2. all right; acceptable; in an acceptable way
OK,exclamation,1. yes; all right 2. used to attract somebody’s attention or to introduce a comment
October,noun,"the 10th month of the year, between September and November"
Saturday,noun,the day of the week after Friday and before Sunday
September,noun,"the 9th month of the year, between August and October"
South,,the direction that is on your right when you watch the sun rise; one of the four main points of the compass
Spanish,noun,"the language of Spain, Mexico and most countries in Central and South America"
Sunday,noun,"1. the day of the week after Saturday and before Monday, thought of as either the first or the last day of the week 2. a newspaper published on a Sunday"
T-shirt,noun,"an informal shirt, usually with short sleeves (= arms) no collar or buttons, or just a few buttons at the top"
TV,noun,1. television 2. being broadcast by television; appearing in a television programme
Thursday,noun,the day of the week after Wednesday and before Friday
Tuesday,noun,the day of the week after Monday and before Wednesday
Wednesday,noun,the day of the week after Tuesday and before Thursday
about,adverb,1. a little more or less than; a little before or after 2. nearly; very close to
about,preposition,1. on the subject of somebody/something; in connection with somebody/something 2. used to describe the purpose or an aspect of something
above,adverb,"1. at or to a higher place 2. greater in number, level or age"
above,preposition,"1. at or to a higher place or position than something/somebody 2. more than something; greater in number, level or age than somebody/something"
across,adverb,1. from one side to the other side 2. in a particular direction towards or at somebody/something
across,preposition,1. from one side to the other side of something 2. on the other side of something
action,noun,1. the process of doing something in order to make something happen or to deal with a situation 2. a thing that somebody does
activity,noun,1. a thing that you do for interest or pleasure 2. a thing that somebody does in order to achieve a particular aim
actor,noun,"1. a person who performs on the stage, on television or in films, especially as a profession 2. a person who plays a part, pretending by their behaviour to be a particular kind of person"
actress,noun,"1. a woman who performs on the stage, on television or in films, especially as a profession 2. a woman who plays a part, pretending by her behaviour to be a particular kind of person"
add,verb,"1. to put something together with something else so as to increase the size, number, amount, etc. 2. to put numbers or amounts together to get a total"
address,noun,"1. details of where somebody lives or works and where letters, etc. can be sent 2. a series of words and symbols that tells you where you can find something using a computer or phone, for example on the internet"
adjective,noun,"a word that describes a person or thing, for example big, blue and clever in a big house, blue sky and a clever idea"
adult,noun,1. a fully grown person who is legally responsible for their actions 2. a fully grown animal
adverb,noun,"a word that adds more information about place, time, manner, cause or degree to a verb, an adjective, a phrase or another adverb"
advice,noun,an opinion or a suggestion about what somebody should do in a particular situation
afraid,adjective,1. feeling fear; frightened because you think that you might be hurt or suffer 2. worried about what might happen
after,preposition,1. later than something; following something in time 2. next to and following somebody/something in order or importance
afternoon,noun,the period of time from 12 o'clock in the middle of the day until about 6 o’clock in the evening
again,adverb,1. one more time; on another occasion 2. showing that somebody/something is in the same place or state that they were in originally
age,noun,1. the number of years that a person has lived or a thing has existed 2. a very long time
ago,adverb,used in expressions of time with the simple past tense to show how far in the past something happened
agree,verb,1. to have the same opinion as somebody; to say that you have the same opinion 2. to approve of something because you think it is morally right
air,noun,1. the mixture of gases that surrounds the earth and that we breathe 2. the space above the ground or that is around things
airplane,noun,a flying vehicle with wings and one or more engines
airport,noun,"1. a place where planes land and take off and that has buildings for passengers to wait in 2. used to describe novels that are popular and easy to read, often bought by people at airports"
all,,the whole number of
alphabet,noun,a set of letters or symbols in a fixed order used for writing a language
also,adverb,in addition; too
always,adverb,1. at all times; on every occasion 2. for a long time; since you can remember
amazing,adjective,"1. very surprising, especially in a way that you like or admire 2. very impressive; excellent"
and,conjunction,1. also; in addition to 2. then; following this
angry,adjective,"1. having strong feelings about something that you dislike very much or about an unfair situation 2. red and painful, usually because of an infection"
animal,noun,"1. a creature that is not a bird, a fish, a reptile, an insect or a human 2. any living thing that is not a plant or a human"
another,,one more; an extra thing or person
answer,verb,"1. to say, write or do something as a reaction to a question or situation 2. to defend yourself against a charge or criticism"
answer,noun,"1. something that you say, write or do to react to a question or situation 2. something that you write or say in reply to a question in a test, an exam, an exercise, etc.; the correct reply to a question in a test, etc."
any,,"used with uncountable or plural nouns in negative sentences and questions, after if or whether, and after some verbs such as prevent, ban, forbid, etc. to refer to an amount or a number of something, however large or small"
anyone,,"used instead of someone in negative sentences and in questions after if/whether, and after verbs such as prevent, forbid, avoid, etc."
anything,,"used instead of something in negative sentences and in questions; after if/whether; and after verbs such as prevent, ban, avoid, etc."
apartment,noun,"1. a set of rooms for living in, usually on one floor of a building 2. a set of rooms used for a holiday"
apple,noun,1. a round fruit with shiny red or green skin that is fairly hard and white inside 2. a child usually behaves in a similar way to his or her parent(s)
area,noun,"1. part of a place, town, etc., or a region of a country or the world 2. a part of a room, building or particular space that is used for a special purpose"
arm,noun,1. either of the two long parts that stick out from the top of the body and connect the shoulders to the hands 2. the part of a piece of clothing that covers the arm
around,adverb,1. approximately 2. on every side; surrounding somebody/something
around,preposition,"1. surrounding somebody/something; on each side of something 2. on, to or from the other side of somebody/something"
arrive,verb,"1. to get to a place, especially at the end of a journey 2. to be brought to somebody"
art,noun,"1. the use of the imagination to express ideas or feelings, particularly in painting, drawing or sculpture  2. examples of objects such as paintings, drawings or sculptures"
article,noun,"1. a piece of writing about a particular subject in a newspaper or magazine, on a website, etc. 2. a separate item in an agreement or a contract"
artist,noun,"1. a person who creates works of art, especially paintings or drawings 2. a person who is a professional singer, dancer, actor, etc."
as,preposition,1. used to describe somebody/something appearing to be somebody/something else 2. used to describe the fact that somebody/something has a particular job or function
ask,verb,"1. to say or write something in the form of a question, in order to get information 2. to tell somebody that you would like them to do something or that you would like something to happen"
at,preposition,1. used to say where something/somebody is or where something happens 2. used to say where somebody works or studies
aunt,noun,"1. the sister of your father or mother; the wife of your uncle or aunt 2. used by children, with a first name, to address a woman who is a friend of their parents"
autumn,noun,"the season of the year between summer and winter, when leaves change colour and the weather becomes colder"
away,adverb,1. to or at a distance from somebody/something in space or time 2. to a different place or in a different direction
baby,noun,1. a very young child or animal 2. the youngest member of a family or group
back,noun,"1. the part of the human body that is on the opposite side to the chest, between the neck and the tops of the legs; the part of an animal’s body that corresponds to this 2. the row of bones in the middle of the back"
back,adverb,"1. to or into the place, condition, situation or activity where somebody/something was before 2. away from the front or centre; behind you"
bad,adjective,1. unpleasant; full of problems 2. of poor quality; below an acceptable standard
bag,noun,"1. a container made of cloth, leather, plastic or paper, used to carry things in, especially when shopping or travelling 2. a bag or case that you take when you are travelling; a piece of luggage"
ball,noun,"1. a round object used for throwing, hitting or kicking in games and sports 2. a round object or a thing that has been formed into a round shape"
banana,noun,"1. a long curved fruit with a thick yellow skin and that is soft inside, which grows on trees in hot countries 2. to become angry, crazy or silly"
band,noun,"1. a small group of musicians who play popular music together, often with a singer or singers 2. a group of musicians who play brass and percussion instruments"
bank,noun,"1. an organization that provides various financial services, for example keeping or lending money 2. a supply of money or things that are used as money in some games, especially those in which gambling is involved"
banknote,noun,a piece of paper money
bath,noun,"1. a large, long container that you put water in and then get into to wash your whole body 2. an act of washing your whole body by sitting or lying in water"
bathroom,noun,"1. a room in which there is a bath, a washbasin and often a toilet 2. a room in which there is a toilet, a sink and sometimes a bath or shower"
be,verb,"1. used when you are naming people or things, describing them or giving more information about them 2. used when you are describing a situation or saying what you think about it"
beach,noun,"an area of sand or small stones (called shingle), next to the sea or a lake"
beautiful,adjective,1. having beauty; giving pleasure to the senses or to the mind 2. very good; very kind or showing great skill
because,conjunction,for the reason that
become,verb,1. to start to be something 2. to be suitable for somebody
bed,noun,"1. a piece of furniture for sleeping on 2. the bottom of a river, the sea, etc."
bedroom,noun,1. a room for sleeping in 2. having the number of bedrooms mentioned
beer,noun,"1. an alcoholic drink made from malt with hops added to give it taste. There are many types of beer. 2. a glass, bottle or can of beer"
before,preposition,1. earlier than somebody/something 2. used to say that somebody/something is ahead of somebody/something in an order or arrangement
begin,verb,"1. to start doing something; to do the first part of something 2. to start to happen or exist, especially from a particular time"
beginning,noun,"1. the time when something starts; the first part of an event, a story, etc. 2. the first or early ideas, signs or stages of something"
behind,adverb,1. at or towards the back of somebody/something; further back 2. in the place where somebody/something is or was
behind,preposition,"1. at or towards the back of somebody/something, and often hidden by it or them 2. making less progress than somebody/something"
believe,verb,"1. to feel certain that something is true or that somebody is telling you the truth 2. to think that something is true or possible, although you are not completely certain"
below,adverb,"1. at or to a lower level, position or place 2. at a lower rank"
below,preposition,1. at or to a lower level or position than somebody/something 2. of a lower amount or standard than somebody/something
best,adjective,1. of the most excellent type or quality 2. giving most pleasure; happiest
better,adjective,1. of a higher standard or less poor quality; not as bad as something else 2. more suitable or appropriate
between,preposition,"1. in or into the space separating two or more points, objects, people, etc. 2. in the period of time that separates two days, years, events, etc."
bicycle,noun,a road vehicle with two wheels that you ride by pushing the pedals with your feet
big,adjective,"1. large in size, degree, amount, etc. 2. older"
bike,noun,1. a bicycle 2. a motorcycle
bill,noun,1. a document that shows how much you owe somebody for goods or services 2. a piece of paper that shows how much you have to pay for the food and drinks that you have had in a restaurant
bird,noun,"1. a creature that is covered with feathers and has two wings and two legs. Most birds can fly. 2. a person of a particular type, especially somebody who is strange or unusual in some way"
birthday,noun,1. the day in each year which is the same date as the one on which you were born 2. not wearing any clothes
black,adjective,"1. having the very darkest colour, like coal or the sky at night 2. without light; completely dark"
black,noun,"1. the very darkest colour, like night or coal 2. a member of a group of people who have dark skin, especially people who come from or whose ancestors came from Africa"
blog,noun,"a website where an individual person, or people representing an organization, write regularly about recent events or topics that interest them, usually with photos and links to other websites that they find interesting"
blonde,adjective,1. pale gold in colour 2. having blonde hair
blue,noun,1. the colour of a clear sky or the sea on a clear day 2. a person who has played a particular sport for Oxford or Cambridge University; a title given to them
blue,adjective,1. having the colour of a clear sky or the sea on a clear day 2. looking slightly blue in colour because the person is cold or cannot breathe easily
boat,noun,"1. a vehicle (smaller than a ship) that travels on water, moved by oars, sails or a motor 2. any ship"
body,noun,"1. the whole physical structure of a human or an animal 2. the main part of a body not including the head, or not including the head, arms and legs"
book,noun,1. a set of printed pages that are fastened inside a cover so that you can turn them and read them 2. a written work published in printed or electronic form
boot,noun,"1. a strong shoe that covers the foot and ankle and often the lower part of the leg 2. the space at the back of a car that you put bags, cases, etc. in"
bored,adjective,1. feeling tired and impatient because you have lost interest in somebody/something or because you have nothing to do 2. to be extremely frightened or bored
boring,adjective,not interesting; making you feel tired and impatient
born,verb,1. to come out of your mother’s body at the beginning of your life 2. to start to exist
both,,used with plural nouns to mean ‘the two’ or ‘the one as well as the other’
bottle,noun,"1. a glass or plastic container, usually round with straight sides and a narrow neck, used especially for storing liquids 2. the amount contained in a bottle"
box,noun,"1. a container made of wood, thick card, metal, etc. with a flat stiff base and sides and often a lid (= cover), used especially for holding solid things 2. a box and its contents; the things a box contains"
boy,noun,1. a male child or a young male person 2. a young son
boyfriend,noun,a man or boy that somebody has a romantic or sexual relationship with
bread,noun,"1. a type of food made from flour, water and usually yeast mixed together and baked 2. money"
break,verb,"1. to be damaged and separated into two or more parts, as a result of force; to damage something in this way 2. to stop working as a result of being damaged; to damage something and stop it from working"
break,noun,"1. a short period of time when you stop what you are doing and rest, eat, etc. 2. a period of time between lessons at school"
breakfast,noun,1. the first meal of the day 2. a thing that has been done badly
bring,verb,1. to come to a place with somebody/something 2. to give or provide somebody/something with something
brother,noun,"1. a boy or man who has the same parents as another person 2. used for talking to or talking about other male members of an organization or other men who have the same ideas, purpose, etc. as yourself"
brown,adjective,1. having the colour of earth or coffee 2. having skin that is naturally brown or has been made brown by the sun
brown,noun,the colour of earth or coffee
build,verb,"1. to make something, especially a building, by putting parts together 2. to create or develop something"
building,noun,1. a structure such as a house or school that has a roof and walls 2. the process and work of building
bus,noun,"1. a large road vehicle that carries passengers, especially one that travels along a fixed route and stops regularly to let people get on and off 2. a set of wires that carries information from one part of a computer system to another"
business,noun,"1. the activity of making, buying, selling or supplying goods or services for money 2. work that is part of your job"
busy,adjective,1. having a lot to do; perhaps not free to do something else because you are working on something 2. giving all your attention and effort to a particular activity
but,conjunction,1. used to introduce a word or phrase that contrasts with what was said before 2. however; despite this
butter,noun,"1. a soft yellow food made from cream, used in cooking and for spreading on bread 2. used to say that somebody seems to be innocent, kind, etc. when they are not really"
buy,verb,1. to obtain something by paying money for it 2. to be enough to pay for something
by,preposition,1. used for showing how or in what way something is done 2. near somebody/something; at the side of somebody/something; next to somebody/something
bye,exclamation,goodbye
cafe,noun,"1. a place where you can buy drinks and simple meals. Alcohol is not usually served in British or American cafes. 2. a small shop that sells sweets, newspapers, food, etc. and usually stays open later than other shops"
cake,noun,"1. a sweet food made from a mixture of flour, eggs, butter, sugar, etc. that is baked in an oven. Cakes are made in various shapes and sizes and are often decorated, for example with cream or icing. 2. a food mixture that is cooked in a round, flat shape"
call,verb,1. to give somebody/something a particular name; to use a particular name or title when you are talking to somebody 2. to phone somebody
call,noun,1. the act of speaking to somebody on the phone 2. a shout or loud sound made to attract attention
camera,noun,"1. a piece of equipment for taking photographs, moving pictures or television pictures. It can be a separate item or part of another device. 2. in a judge’s private room, without the press or the public being present"
can,verb,"1. used to say that it is possible for somebody/something to do something, or for something to happen 2. used to say that somebody knows how to do something"
cannot,verb,the negative of can; can not
capital,noun,"1. the most important town or city of a country or region, where the government operates from 2. a letter of the form and size that is used at the beginning of a sentence or a name (= A,B,C rather than a,b,c)"
capital,adjective,1. having the form and size used at the beginning of a sentence or a name 2. involving punishment by death
car,noun,1. a road vehicle with an engine and four wheels that can carry a small number of passengers 2. a separate section of a train
card,noun,"1. thick, stiff paper; a piece of this for writing on 2. a piece of stiff paper that is folded in the middle and has a picture on the front of it, used for sending somebody a message with your good wishes, an invitation, etc."
career,noun,"1. the series of jobs that a person has in a particular area of work, usually involving more responsibility as time passes 2. the period of time that you spend in your life working or doing a particular thing"
carrot,noun,1. a long pointed orange root vegetable 2. a reward promised to somebody in order to persuade them to do something
carry,verb,1. to support the weight of somebody/something and take them or it from place to place; to take somebody/something from one place to another 2. to have something with you and take it wherever you go
cat,noun,1. a small animal with soft fur that people often keep as a pet. Cats catch and kill birds and mice. 2. a wild animal of the cat family
cent,noun,"1. a coin and unit of money worth 1% of the main unit of money in many countries, for example of the US dollar or of the euro 2. to give your opinion about something, even if other people do not want to hear it"
center,noun,1. the middle point or part of something 2. the main part of a town or city where there are a lot of shops and offices
centre,noun,1. the middle point or part of something 2. the main part of a town or city where there are a lot of shops and offices
century,noun,1. a period of 100 years 2. any of the periods of 100 years before or after the birth of Christ
chair,noun,"1. a piece of furniture for one person to sit on, with a back, a seat and four legs 2. the position of being in charge of a meeting or committee; the person who holds this position"
change,noun,1. the act or result of something becoming different 2. the process of replacing something with something new or different; a thing that is used to replace something
change,verb,1. to become different 2. to make somebody/something different
chart,noun,"1. a diagram, lists of figures, etc. that shows information 2. a detailed map of the sea"
cheap,adjective,1. costing little money or less money than you expected 2. charging low prices
