english,tag,definition
African,noun,"a person from Africa, especially a black person"
African,adjective,of or connected with Africa
Arabic,noun,the language of the Arabs
Asian,adjective,of or connected with Asia
Asian,noun,"a person from Asia, or whose family originally came from Asia"
Chinese,noun,"1. a person from China, or whose family was originally from China 2. the language of China"
European,noun,"1. a person from Europe, or whose ancestors came from Europe 2. a person who supports the principles and aims of the European Union"
European,adjective,1. of or connected with Europe 2. of or connected with the European Union
Facebook,noun,a very popular social media website
Google,,to type words into the search engine Google™ in order to find information about somebody/something
Greek,noun,1. a person from modern or ancient Greece 2. the language of modern or ancient Greece
Hollywood,noun,the part of Los Angeles where the film industry is based (used to refer to the US film industry and the way of life that is associated with it)
Latin,noun,"1. the language of ancient Rome and the official language of its empire 2. a person from countries where languages that have developed from Latin, such as Spanish, Portuguese, Italian or French, are spoken"
MP3,noun,a method of reducing the size of a computer file containing sound; a file that is reduced in size in this way
Polish,noun,1. a substance used when rubbing a surface to make it smooth and shiny 2. an act of polishing something
Portuguese,noun,1. a person from Portugal 2. the language used in Portugal and Brazil and some other countries
Roman,adjective,1. connected with ancient Rome or the Roman Empire 2. connected with the modern city of Rome
Russian,noun,1. a person from Russia 2. the language of Russia
ability,noun,1. the fact that somebody/something is able to do something 2. a level of skill or intelligence
able,adjective,"1. having the skill, intelligence, opportunity, etc. needed to do something 2. intelligent; good at something"
abroad,adverb,1. in or to a foreign country 2. being talked about or felt by many people
accept,verb,"1. to take willingly something that is offered; to say ‘yes’ to an offer, invitation, etc. 2. to agree to or approve of something"
accident,noun,"1. an unpleasant event, especially in a vehicle, that happens unexpectedly and causes injury or damage 2. something that happens unexpectedly and is not planned in advance"
according,preposition,"to give somebody/something authority, status or a particular type of treatment"
ache,noun,a continuous feeling of pain in a part of the body
ache,verb,1. to feel a continuous pain that is not severe 2. to have a strong desire for somebody/something or to do something
achieve,verb,"1. to succeed in reaching a particular goal, status or standard, especially by making an effort for a long time 2. to succeed in doing something or causing something to happen"
act,verb,1. to do something for a particular purpose or in order to deal with a situation 2. to behave in a particular way
acting,noun,"the activity or profession of performing in plays, films, etc."
active,adjective,"1. always busy doing things, especially physical activities 2. involved in something; making a determined effort and not leaving something to happen by itself"
actually,adverb,"1. used in speaking to emphasize a fact or a comment, or that something is really true 2. used to show a contrast between what is true and what somebody believes, and to show surprise about this contrast"
adult,noun,1. a fully grown person who is legally responsible for their actions 2. a fully grown animal
adult,adjective,1. fully grown or developed 2. behaving in an intelligent and responsible way; typical of what is expected of an adult
advantage,noun,1. a thing that helps you to be better or more successful than other people 2. a quality of something that makes it better or more useful
adventure,noun,"1. an unusual, exciting or dangerous experience, journey or series of events 2. the quality of being excited and willing to take risks, try new ideas, etc."
advert,noun,"1. a notice, picture or film telling people about a product, job or service 2. an example of something that shows its good qualities"
advertise,verb,"1. to tell the public about a product or a service in order to encourage people to buy or to use it 2. to let people know that something is going to happen, or that a job is available by giving details about it in a newspaper, on a notice in a public place, on the internet, etc."
advertisement,noun,"1. a notice, picture or film telling people about a product, job or service 2. an example of something that shows its good qualities"
advertising,noun,"the activity and industry of advertising things to people on television, in newspapers, on the internet, etc."
affect,verb,1. to produce a change in somebody/something 2. to attack somebody or a part of the body; to make somebody become ill
after,adverb,later in time; afterwards
after,conjunction,at a time later than something; when something has finished
afternoons,adverb,during the afternoon every day
against,preposition,1. opposing or disagreeing with somebody/something 2. not to the advantage or favour of somebody/something
agree,verb,1. to have the same opinion as somebody; to say that you have the same opinion 2. to approve of something because you think it is morally right
ah,exclamation,"used to express surprise, pleasure or sympathy, or when you disagree with somebody"
airline,noun,a company that provides regular flights to take passengers and goods to different places
alive,adjective,"1. living; not dead 2. full of emotion, excitement, activity, etc."
all,adverb,the whole number of
all,adjective,the whole number of
all,exclamation,the whole number of
allow,verb,1. to let somebody/something do something; to let something happen or be done 2. to let somebody have something
almost,adverb,not quite
alone,adjective,1. without any other people 2. without the help of other people or things
alone,adverb,1. without any other people 2. without the help of other people or things
along,adverb,1. forward 2. with somebody
along,preposition,1. from one end to or towards the other end of something 2. in a line that follows the side of something long
already,adverb,1. before now or before a particular time in the past 2. used to express surprise that something has happened so soon or so early
alright,adjective,1. acceptable; in an acceptable manner 2. safe and well
alright,exclamation,1. used to check that somebody agrees or understands 2. used to say that you agree
alternative,noun,a thing that you can choose to do or have out of two or more possibilities
although,conjunction,1. used for introducing a statement that makes the main statement in a sentence seem surprising 2. used to mean ‘but’ or ‘however’ when you are commenting on a statement
among,preposition,1. surrounded by somebody/something; in the middle of somebody/something 2. being included or happening in groups of things or people
amount,noun,1. a quantity of something 2. a sum of money
ancient,adjective,1. belonging to a period of history that is thousands of years in the past 2. very old; having existed for a very long time
ankle,noun,the joint connecting the foot to the leg; the narrow part of the leg just above the ankle joint
any,adverb,"used with uncountable or plural nouns in negative sentences and questions, after if or whether, and after some verbs such as prevent, ban, forbid, etc. to refer to an amount or a number of something, however large or small"
anybody,noun,"1. used instead of somebody in negative sentences and in questions after if/whether, and after verbs such as prevent, forbid, avoid, etc. 2. any person at all; it does not matter who"
anyway,adverb,1. used when adding something to support an idea or argument 2. despite something; even so
anywhere,noun,used in negative sentences and in questions instead of somewhere
anywhere,adverb,"1. used in negative sentences and in questions instead of somewhere 2. in, at or to any place, when it does not matter where"
app,noun,"1. a piece of software that you can download to a device such as a smartphone or tablet, for example to look up information or to play a game 2. a program designed to do a particular job; a piece of software"
appear,verb,1. to start to be seen 2. to begin to exist or be known or used for the first time
appearance,noun,"1. the way that somebody/something looks on the outside; what somebody/something seems to be 2. the fact of somebody/something arriving, especially when it is not expected"
apply,verb,"1. to make a formal request, usually in writing, for something such as a job, a loan, permission for something, a place at a university, etc. 2. to affect or be relevant to somebody/something"
architect,noun,"1. a person whose job is designing buildings 2. a person who is responsible for planning or creating an idea, an event or a situation"
architecture,noun,1. the art and study of designing buildings 2. the design or style of a building or buildings
argue,verb,"1. to speak angrily to somebody because you disagree with them 2. to give reasons why you think that something is right/wrong, true/not true, etc., especially to persuade people that you are right"
argument,noun,"1. a conversation or discussion in which two or more people disagree, often angrily 2. a reason or set of reasons that somebody uses to show that something is true or correct"
army,noun,1. a large organized group of soldiers who are trained to fight on land 2. the part of a country’s armed forces that fights on land
arrange,verb,1. to plan or organize something in advance 2. to put something in a particular order; to make something neat or attractive
arrangement,noun,1. a plan or preparation that you make so that something can happen 2. the way things are done or organized
as,conjunction,1. while something else is happening 2. in the way in which
as,adverb,"1. used when you are comparing two people or things, or two situations 2. used to say that something happens in the same way"
asleep,adjective,"1. sleeping 2. used to describe a part of the body that has no feeling in it, usually because it has been in the same position for too long"
assistant,noun,"1. a person who helps or supports somebody, usually in their job 2. a person whose job is to serve customers in a shop"
assistant,adjective,having a rank below that of a senior person and helping them in their work
athlete,noun,"1. a person who competes in sports 2. a person who competes in sports such as running, jumping and throwing "
attack,noun,"1. an act of using violence to try to hurt or kill somebody 2. an act of trying to kill or injure the enemy in war, using weapons such as guns and bombs"
attack,verb,"1. to use violence to try to hurt or kill somebody 2. to use weapons, such as guns and bombs against an enemy in a war, etc."
attend,verb,1. to be present at an event 2. to go regularly to a place
attention,noun,"1. the act of listening to, looking at or thinking about something/somebody carefully; interest that people show in somebody/something 2. special care, action or treatment"
attention,exclamation,1. used for asking people to listen to something that is being announced 2. used for ordering soldiers to stand to attention
attractive,adjective,"1. pleasant to look at, especially in a sexual way 2. pleasant"
audience,noun,"1. the group of people who have gathered to watch or listen to something (a play, concert, somebody speaking, etc.) 2. a number of people or a particular group of people who watch, read, or listen to the same thing"
author,noun,"1. a person who writes books or the person who wrote a particular book 2. the person who creates or starts something, especially a plan or an idea"
available,adjective,"1. that you can get, buy or find 2. free to see or talk to people"
average,noun,"1. the result of adding several amounts together, finding a total, and dividing the total by the number of amounts 2. a level that is usual"
average,adjective,"1. calculated by adding several amounts together, finding a total, and dividing the total by the number of amounts 2. typical or normal"
avoid,verb,1. to prevent something bad from happening 2. to keep away from somebody/something; to try not to do something
award,noun,"1. a prize such as money, etc. for something that somebody has done 2. an increase in the amount of money somebody earns"
awful,adjective,1. very bad or unpleasant 2. that shocks people very much
back,adjective,1. located behind or at the back of something 2. of or from a past time
background,noun,"1. the details of a person’s family, education, experience, etc. 2. the circumstances or past events that help explain why something is how it is; information about these"
bad,adjective,1. unpleasant; full of problems 2. of poor quality; below an acceptable standard
badly,adverb,1. without skill or care 2. not successfully
bag,noun,"1. a container made of cloth, leather, plastic or paper, used to carry things in, especially when shopping or travelling 2. a bag or case that you take when you are travelling; a piece of luggage"
baggage,noun,"1. bags, cases, etc. that contain somebody's clothes and things when they are travelling 2. the equipment that an army carries with it"
bar,noun,1. a place where you can buy and drink alcoholic and other drinks 2. a place in which a particular kind of food or drink is the main thing that is served
baseball,noun,"1. a game played especially in the US by two teams of nine players, using a bat and ball. Each player tries to hit the ball and then run around four bases before the other team can return the ball. 2. the ball used in this game"
based,adjective,"1. if one thing is based on another, it uses it or is developed from it 2. if a person or business is based in a particular place, that is where they live or work, or where the work of the business is done"
basketball,noun,"1. a game played by two teams of five players, using a large ball which players try to throw into a high net hanging from a ring 2. the ball used in this game"
bean,noun,"1. a seed, or pod containing seeds, of a climbing plant, eaten as a vegetable. There are several types of bean and the plants that they grow on are also called beans. 2. a seed from a coffee plant, or some other plants"
bear,noun,"1. a heavy wild animal with thick fur and sharp claws (= pointed parts on the ends of its feet). There are many types of bear. 2. a person who sells shares in a company, etc., hoping to buy them back later at a lower price"
beard,noun,hair that grows on the chin and sides of somebody's face; similar hair that grows on some animals
beat,verb,1. to defeat somebody in a game or competition 2. to do or be better than something
beef,noun,1. meat that comes from a cow 2. a complaint
beefburger,noun,"beef cut into small pieces and made into a flat round shape that is then fried, often served in a bread roll"
before,adverb,at an earlier time; in the past; already
before,conjunction,1. earlier than the time when 2. until
behave,verb,1. to do things in a particular way 2. to do things in a way that people think is correct or polite
behaviour,noun,"1. the way that somebody behaves, especially towards other people 2. the way a person, an animal, a plant, a chemical, etc. behaves or functions in a particular situation"
belong,verb,1. to be in the right or suitable place 2. to feel comfortable and happy in a particular situation or with a particular group of people
belt,noun,"1. a long narrow piece of leather, cloth, etc. that you wear around the middle part of your body 2. a continuous band of material that moves round and is used to carry things along or to drive a machine"
benefit,noun,"1. an advantage that something gives you; a helpful and useful effect that something has 2. money provided by the government to people who need financial help because they are unemployed, ill, etc."
best,adverb,1. most; to the greatest extent 2. in the most excellent way; to the highest standard
best,noun,1. the most excellent thing or person 2. the highest standard that somebody/something can reach
better,adjective,1. of a higher standard or less poor quality; not as bad as something else 2. more suitable or appropriate
better,adverb,1. in a more excellent or pleasant way; not as badly 2. more; to a greater degree
between,adverb,"1. in the space or period of time separating two or more points, objects, etc. or two dates, events, etc. 2. in a middle position; neither one thing nor the other"
bin,noun,"1. a container that you put waste in 2. a large container, usually with a lid (= cover), for storing things in"
biology,noun,1. the scientific study of the life and structure of plants and animals 2. the way in which the body and cells of a living thing behave
birth,noun,"1. the time when a baby is born; the process of being born 2. the beginning of a new situation, idea, place, etc."
biscuit,noun,"1. a small flat dry cake for one person, usually sweet, and baked until hard 2. a soft bread roll, often eaten with gravy"
bit,noun,1. rather; to some extent 2. a short time or distance
blank,noun,"1. an empty space on a printed form or document for you to write answers, information, etc. in 2. a state of not being able to remember anything"
blank,adjective,"1. empty, with nothing written, printed or recorded on it 2. empty; with no pictures, marks or decoration"
blood,noun,1. the red liquid that flows through the bodies of humans and animals 2. having the type of blood mentioned
blow,verb,"1. to send out air from the mouth 2. when the wind or a current of air blows, it is moving; when it blows, the wind is blowing"
board,noun,"1. a long thin piece of strong hard material, especially wood, used, for example, for making floors, building walls and roofs and making boats 2. a piece of wood, or other strong material, that is used for a special purpose"
boil,verb,"1. when a liquid boils or when you boil it, it is heated to the point where it forms bubbles and turns to steam or vapour 2. when a kettle, pan, etc. boils or when you boil a kettle, etc., it is heated until the water inside it boils"
bone,noun,1. any of the hard parts that form the skeleton of the body of a human or an animal 2. the hard substance that bones are made of
book,verb,"1. to arrange to have or use something on a particular date in the future; to buy a ticket in advance 2. to arrange for somebody to have a seat on a plane, etc."
bookshop,noun,a shop that sells books
boot,noun,"1. a strong shoe that covers the foot and ankle and often the lower part of the leg 2. the space at the back of a car that you put bags, cases, etc. in"
borrow,verb,"1. to take and use something that belongs to somebody else, and return it to them at a later time 2. to take money from a person or bank and agree to pay it back to them at a later time"
boss,noun,1. a person who is in charge of other people at work and tells them what to do 2. a person who is in charge of a large organization
bottom,noun,1. the lowest part of something 2. the part of something that faces downwards and is not usually seen
bottom,adjective,"1. in the lowest, last or furthest place or position 2. the lowest or last position in a scale or competition"
bowl,noun,"1. a deep round dish with a wide open top, used especially for holding food or liquid 2. the amount contained in a bowl"
brain,noun,"1. the organ inside the head that controls movement, thought, memory and feeling 2. the brain of an animal, eaten as food"
bridge,noun,"1. a structure that is built over a road, railway, river, etc. so that people, vehicles, etc. can cross from one side to the other 2. a thing that provides a connection or contact between two different things"
bright,adjective,1. full of light; shining strongly 2. strong and easy to see
brilliant,adjective,1. extremely clever or impressive 2. very good; excellent
bring,verb,1. to come to a place with somebody/something 2. to give or provide somebody/something with something
broken,adjective,1. that has been damaged or injured; no longer whole or working correctly 2. not kept
brush,noun,"1. an object made of short stiff hairs (called bristles) or wires set in a block of wood or plastic, usually attached to a handle. Brushes are used for many different jobs, such as cleaning, painting and tidying your hair. 2. an act of brushing"
brush,verb,"1. to clean, polish or make something smooth with a brush 2. to remove or try to remove something from a place or surface with a brush or with your hand"
builder,noun,"1. a person or company whose job is to build or repair houses or other buildings 2. a person or thing that builds, creates or develops something"
burn,verb,1. to produce flames and heat 2. to be on fire
businessman,noun,"1. a man who works in business, especially at a high level 2. a man who shows skill in business and financial matters"
businesswoman,noun,"1. a woman who works in business, especially at a high level 2. a woman who shows skill in business and financial matters"
button,noun,"1. a small round piece of metal, plastic, etc. that is sewn onto a piece of clothing and used for fastening two parts together 2. a small part of a machine that you press to make it work"
cake,noun,"1. a sweet food made from a mixture of flour, eggs, butter, sugar, etc. that is baked in an oven. Cakes are made in various shapes and sizes and are often decorated, for example with cream or icing. 2. a food mixture that is cooked in a round, flat shape"
caller,noun,1. a person who is making a phone call 2. a person who goes to a house or a building
camp,noun,1. a place where people live temporarily in tents or temporary buildings 2. a place where children go in the summer and take part in sports and other activities
camp,verb,"1. to put up a tent and live in it for a short time 2. to stay in a tent, especially while you are on holiday"
camping,noun,"living in a tent, etc. on holiday"
can,verb,"1. used to say that it is possible for somebody/something to do something, or for something to happen 2. used to say that somebody knows how to do something"
can,noun,a metal container in which food and drink is sold
candy,noun,"1. sweet food made of sugar and/or chocolate, eaten between meals; a piece of this 2. used to emphasize how easy it is to do something"
car,noun,1. a road vehicle with an engine and four wheels that can carry a small number of passengers 2. a separate section of a train
card,noun,"1. thick, stiff paper; a piece of this for writing on 2. a piece of stiff paper that is folded in the middle and has a picture on the front of it, used for sending somebody a message with your good wishes, an invitation, etc."
care,verb,1. to feel that something is important and worth worrying about 2. to like or love somebody and worry about what happens to them
care,noun,1. the process of caring for somebody/something and providing what they need for their health or protection 2. the fact of providing a home in an institution run by the local authority or with another family for children who cannot live with their parents
careful,adjective,"1. giving attention or thought to what you are doing so that you avoid hurting yourself, damaging something or doing something wrong 2. giving a lot of attention to details"
carefully,adverb,"1. with a lot of attention or thought, so that you avoid hurting yourself, damaging something or doing something wrong 2. with a lot of attention to detail"
carpet,noun,"1. a piece of thick woven material made of wool, etc., used to cover the floor of a room or stairs; the material used for carpets 2. a thick layer of something on the ground"
cartoon,noun,"1. a humorous drawing in a newspaper or magazine, especially one about politics or events in the news 2. a series of drawings inside boxes that tell a story and are often printed in newspapers"
case,noun,1. a particular situation or a situation of a particular type 2. the true situation
cash,noun,1. money in the form of coins or notes 2. money in any form
castle,noun,"1. a large strong building with thick, high walls and towers, built in the past by kings or queens, or other important people, to defend themselves against attack 2. any of the four pieces placed in the corner squares of the board at the start of the game, usually made to look like a castle"
catch,verb,"1. to stop and hold a moving object or person, especially in your hands 2. to hold a liquid when it falls"
cause,noun,1. the person or thing that makes something happen 2. a reason for having particular feelings or behaving in a particular way
cause,verb,"to make something happen, especially something bad or unpleasant; to make somebody do something"
celeb,noun,a celebrity
celebrate,verb,"1. to show that a day or an event is important by doing something special on it 2. to perform a religious ceremony, especially the Christian communion service"
celebrity,noun,1. a famous person 2. the state of being famous
cent,adjective,"1. a coin and unit of money worth 1% of the main unit of money in many countries, for example of the US dollar or of the euro 2. to give your opinion about something, even if other people do not want to hear it"
cent,noun,"1. a coin and unit of money worth 1% of the main unit of money in many countries, for example of the US dollar or of the euro 2. to give your opinion about something, even if other people do not want to hear it"
centimetre,noun,a unit for measuring length. There are 100 centimetres in a metre.
centre,noun,1. the middle point or part of something 2. the main part of a town or city where there are a lot of shops and offices
certain,adjective,1. strongly believing something; having no doubts 2. that you can rely on to happen or to be true
