english,tag,definition
included,adjective,contained as part of something
including,preposition,having something as part of a group or set
increase,noun,"a rise in the amount, number or value of something"
increase,verb,"to become greater in amount, number, value, etc.; to make something greater in amount, number, value, etc."
incredible,adjective,1. impossible or very difficult to believe 2. extremely good
independent,adjective,1. having its own government 2. confident and free to do things without needing help from other people
individual,noun,1. a person considered separately rather than as part of a group 2. a single member of a class of things
individual,adjective,1. considered separately rather than as part of a group 2. connected with one person; designed for one person
industry,noun,"1. the production of goods from raw materials, especially in factories 2. the people and activities involved in producing a particular thing, or in providing a particular service"
informal,adjective,1. relaxed and friendly; not following strict rules of how to behave or do something 2. suitable for normal conversation and writing to friends rather than for serious speech and letters
injury,noun,"1. harm done to a person’s or an animal’s body, for example in an accident 2. damage to a person’s feelings"
insect,noun,"any small creature with six legs and a body divided into three parts. Insects usually also have wings. Ants, bees and flies are all insects."
inside,noun,"1. the inner part, side or surface of something 2. the part of a road nearest the edge, that is used by slower vehicles"
inside,adjective,1. forming the inner part of something; not on the outside 2. known or done by somebody in a group or an organization
inside,adverb,1. on or to the inside 2. in prison
inside,preposition,1. on or to the inner part of something/somebody; within something/somebody 2. in less than the amount of time mentioned
instead,adverb,in the place of somebody/something
instruction,noun,1. detailed information on how to do or use something  2. something that somebody tells you to do 
instructor,noun,1. a person whose job is to teach somebody a practical skill or sport 2. a teacher below the rank of assistant professor at a college or university
instrument,noun,"1. an object used for producing musical sounds, for example a piano or a drum 2. a tool or device used for a particular task, especially for specialist or scientific work"
intelligent,adjective,"1. good at learning, understanding and thinking in a logical way about things; showing this ability 2. able to understand and learn things"
international,adjective,1. connected with or involving two or more countries 2. used by people of many different countries
interviewer,noun,the person who asks the questions in an interview
introduce,verb,"1. to tell two or more people who have not met before what each other’s names are; to tell somebody what your name is 2. to be the main speaker in a television or radio show, who gives details about the show and who presents the people who are in it; to tell the audience the name of the person who is going to speak or perform"
introduction,noun,"1. the first part of a book or speech that gives a general idea of what is to follow 2. the act of making one person formally known to another or a group of others, in which you tell them the person's name "
invent,verb,"1. to produce or design something that has not existed before 2. to say or describe something that is not true, especially in order to trick people"
invention,noun,1. a thing or an idea that has been invented 2. the act of inventing something
invitation,noun,1. a spoken or written request to somebody to do something or to go somewhere 2. the act of inviting somebody or of being invited
invite,verb,1. to ask somebody to come to a social event 2. to ask somebody formally to go somewhere or do something; to make a formal or polite request for something
involve,verb,"1. if a situation, an event or an activity involves something, that thing is an important or necessary part or result of it 2. if a situation, an event or an activity involves somebody/something, they take part in it or are affected by it"
irregular,adjective,"1. not arranged in an even way; not having an even, smooth pattern or shape 2. not happening at times that are at an equal distance from each other; not happening regularly"
item,noun,"1. one thing on a list of things to buy, do, talk about, etc. 2. a single object or thing"
itself,noun,"1. used when the animal or thing that does an action is also affected by it 2. used to emphasize an animal, a thing, etc."
jam,noun,"1. a thick sweet substance made by boiling fruit with sugar, often sold in jars and spread on bread 2. a situation in which it is difficult or impossible to move because there are so many people or vehicles in one particular place"
jazz,noun,"1. a type of music with strong rhythms, in which the players often improvise (= make up the music as they are playing), originally created by African American musicians at the beginning of the 20th century 2. and things like that"
jewellery,noun,objects such as rings and necklaces that people wear as decoration
jog,verb,"1. to run slowly and steadily for a long time, especially for exercise 2. to hit something lightly and by accident"
jog,noun,"1. a slow run, especially one done for physical exercise 2. a light push or knock"
jogging,noun,the activity of running slowly and steadily as a form of exercise
joke,verb,1. to say something to make people laugh; to tell a funny story 2. to say something that is not true because you think it is funny
joke,noun,"1. something that you say or do to make people laugh, for example a funny story that you tell 2. a person, thing or situation that is silly or annoying and cannot be taken seriously"
journalist,noun,"a person whose job is to collect and write news stories for newspapers, magazines, radio, television or online news sites"
jump,verb,1. to move quickly off the ground or away from a surface by pushing yourself with your legs and feet 2. to pass over something by jumping
jump,noun,1. an act of jumping 2. a barrier like a narrow fence that a horse or a runner has to jump over in a race or competition
junk,,1. junk food: food that is quick and easy to prepare and eat but that is thought to be bad for your health 2. things that are considered to have no use or value
key,noun,"1. a piece of metal with a special shape used for locking a door, starting a car, etc. 2. a thing that makes you able to understand or achieve something"
kg,abbreviation,kilogram(s)
kick,verb,1. to hit somebody/something with your foot 2. to move your legs as if you were kicking something
kid,noun,1. a child or young person 2. a young goat
kill,verb,1. to make somebody/something die 2. to destroy something or make it less good; to make something stop
kilo,noun,a unit for measuring weight; 1 000 grams
kilogram,noun,a unit for measuring weight; 1 000 grams
king,noun,"1. the male ruler of an independent state that has a royal family 2. a person, an animal or a thing that is thought to be the best or most important of a particular type"
km,abbreviation,(in writing) kilometre(s)
knee,noun,1. the joint between the top and bottom parts of the leg where it bends in the middle 2. the part of a piece of clothing that covers the knee
knife,noun,"1. a sharp blade (= metal edge) with a handle, used for cutting or as a weapon 2. the situation has become so bad that people are preparing to make one person take the blame, for example by taking away their job"
knock,verb,"1. to hit a door, etc. in order to attract attention 2. to hit something hard, often by accident"
knowledge,noun,"1. the information, understanding and skills that you gain through education or experience 2. the state of knowing about a particular fact or situation"
lab,noun,a laboratory
lady,noun,"1. a word used to mean ‘woman’ that some people, especially older people, consider is more polite 2. a woman who is polite and well educated, has excellent manners and always behaves well"
lake,noun,a large area of water that is surrounded by land
lamb,noun,1. a young sheep 2. meat from a young sheep
lamp,noun,"1. a device that uses electricity, oil or gas to produce light 2. an electrical device that produces rays of heat and that is used for medical or scientific purposes"
land,verb,1. to come down through the air onto the ground or another surface 2. to control a plane and bring it down to the ground 
laptop,noun,a small computer that can work with a battery and be easily carried
last,adverb,1. after anyone or anything else; at the end 2. most recently
last,noun,1. the person or thing that comes or happens after all other similar people or things 2. the only part or items that remain of something
last,verb,to continue for a particular period of time
later,adjective,"1. coming after something else or at a time in the future 2. near the end of a period of time, life, etc."
laughter,noun,1. the act or sound of laughing 2. to laugh a lot at somebody/something
law,noun,"1. a rule that deals with a particular crime, agreement, etc. 2. the whole system of rules that everyone in a country or society must obey"
lawyer,noun,"a person who is trained and qualified to advise people about the law and to represent them in court, and to write legal documents"
lazy,adjective,1. unwilling to work or be active; doing as little as possible 2. not involving much energy or activity; slow and relaxed
lead,verb,1. to go with or in front of a person or an animal to show the way or to make them go in the right direction 2. to connect one object or place to another
leader,noun,"1. a person who leads a group of people, especially the head of a country, an organization, etc. 2. a person or thing that is the best, or in first place in a race, business, etc."
learner,noun,1. a person who is finding out about a subject or how to do something 2. a person who is learning to drive a car
learning,noun,1. the process of learning something 2. knowledge that you get from reading and studying
least,noun,"1. smallest in size, amount, degree, etc. 2. used after amounts to show that the amount is the lowest possible"
least,adverb,1. to the smallest degree 2. not less than
lecture,verb,"1. to give a talk or a series of talks to a group of people on a subject, especially as a way of teaching in a university or college 2. to criticize somebody or tell them how you think they should behave, especially when it is done in an annoying way"
lecture,noun,"1. a talk that is given to a group of people to teach them about a particular subject, often as part of a university or college course 2. a long, angry talk that somebody gives to one person or a group of people because they have done something wrong"
lemon,noun,"1. a yellow citrus fruit with juice that has a bitter, sharp taste. Slices of lemon and lemon juice are used in cooking and drinks. 2. lemon juice or a drink made from lemon"
lend,verb,"1. to give something to somebody or allow them to use something that belongs to you, which they have to return to you later 2. to give money to somebody on condition that they pay it back over a period of time and pay interest on it"
less,noun,1. used with uncountable nouns to mean ‘a smaller amount of’ 2. smaller and smaller amounts; at a rate that is decreasing
less,adverb,1. to a smaller degree; not so much 2. continuing to become smaller in amount
level,noun,1. the height of something in relation to the ground or to what it used to be 2. a floor of a building; a layer of ground
lifestyle,noun,the way in which a person or a group of people lives and works
lift,noun,"1. a machine that carries people or goods up and down to different levels in a building or a mine 2. a free ride in a car, etc. to a place you want to get to"
lift,verb,1. to raise somebody/something or be raised to a higher position or level 2. to take hold of somebody/something and move them/it to a different position
light,adjective,1. pale in colour 2. full of light; having the natural light of day
light,verb,1. to make something start to burn 2. to start to burn
likely,adjective,1. having a good chance of happening or being something; probable or expected 2. seeming suitable for a purpose
line,noun,"1. a long, thin mark on a surface 2. a long, thin mark on the ground to show the limit or border of something, especially of a playing area in some sports"
link,noun,"1. a connection between two or more people or things 2. a relationship between two or more people, countries or organizations"
link,verb,"1. to make a physical or electronic connection between one object, machine, place, etc. and another 2. if something links two things, facts or situations, or they are linked, they are connected in some way"
list,noun,"1. a series of names, items, figures, etc., especially when they are written or printed 2. the fact of a ship leaning to one side"
listener,noun,1. a person who listens 2. a person listening to a radio programme or podcast
little,adverb,1. to a small degree 2. not much; only slightly
lock,noun,"1. a device that keeps a door, window, box, etc. shut, usually needing a key to open it 2. a device that prevents a vehicle, machine or piece of equipment from being used"
lock,verb,1. to fasten something with a lock; to be fastened with a lock 2. to put something in a safe place and lock it
look,noun,1. an act of looking at somebody/something 2. an act of trying to find something/somebody
lorry,noun,1. a large vehicle for carrying heavy loads by road 2. goods that fell off the back of a lorry were probably stolen. People say or accept that they came ‘off the back of a lorry’ to avoid saying or asking where they really came from.
lost,adjective,1. unable to find your way; not knowing where you are 2. that cannot be found or brought back
loud,adjective,1. making a lot of noise 2. strongly expressed
loud,adverb,1. in a way that makes a lot of noise or can be easily heard 2. what a person actually does means more than what they say they will do
loudly,adverb,in a way that makes a lot of noise
lovely,adjective,1. beautiful; attractive 2. very pleasant; wonderful
low,adverb,"1. in or into a low position, not far above the ground 2. in or into a position near the bottom of something"
low,adjective,1. not high or tall; not far above the ground 2. at or near the bottom of something
luck,noun,"1. good things that happen to you by chance, not because of your own efforts or abilities 2. chance; the force that causes good or bad things to happen to people"
lucky,adjective,1. having good luck 2. being the result of good luck
luggage,noun,"1. bags, cases, etc. that contain somebody's clothes and things when they are travelling 2. empty bags, cases, etc. for putting your clothes and things in when you are travelling"
lunchtime,noun,the time around the middle of the day when people usually eat lunch
m,abbreviation,male
machine,noun,"1. a piece of equipment with many parts that work together to do a particular task. The power used to work a machine may be electricity, steam, gas, etc. or human power. 2. a computer"
mail,noun,"1. the official system used for sending and delivering letters, packages, etc. 2. letters, packages, etc. that are sent and delivered"
mail,verb,1. to send something to somebody using the postal system 2. to send a message to somebody by email
major,adjective,1. very large or important 2. serious
make,verb,"1. to create or prepare something by combining materials or putting parts together 2. to write, create or prepare something"
male,adjective,1. being a man or boy 2. belonging to the sex that does not lay eggs or give birth to babies
male,noun,"a male person, animal or plant"
manage,verb,"1. to control or be in charge of a business, a team, an organization, land, etc. 2. to succeed in doing something, especially something difficult"
manager,noun,"1. a person who is in charge of running a business, a shop or a similar organization or part of one 2. a person who deals with the business affairs of an actor, a musician, etc."
mango,noun,"a tropical fruit with smooth yellow or red skin, that is soft and orange inside with a large seed"
manner,noun,1. behaviour that is considered to be polite in a particular society or culture 2. the way that something is done or happens
map,noun,"1. a drawing or plan of the earth’s surface or part of it, showing countries, towns, rivers, etc. 2. a diagram to show the positions of things over an area"
mark,verb,"1. to write or draw a symbol, line, etc. on something in order to give information about it 2. to give marks to students’ work"
mark,noun,"1. a written or printed symbol that is used as a sign of something, for example the quality of something or who made or owns it 2. a number or letter that is given to show the standard of somebody’s work or performance or is given to somebody for answering something correctly"
marry,verb,1. to become the husband or wife of somebody; to get married to somebody 2. to perform a ceremony in which two people get married
match,verb,"1. to find somebody/something that goes together with or is connected with another person or thing 2. if two things match or if one thing matches another, they are the same or very similar"
material,noun,1. a substance that things can be made from 2. things that are needed in order to do a particular activity
mathematics,noun,"1. the study of numbers and shapes. Branches of mathematics include arithmetic, algebra, geometry and trigonometry. 2. the process of calculating using numbers"
maths,noun,"1. mathematics, especially as a subject in school 2. the process of calculating using numbers"
matter,verb,to be important or have an important effect on somebody/something
matter,noun,"1. used (to ask) if somebody is upset, unhappy, etc. or if there is a problem 2. a subject or situation that you must consider or deal with"
may,verb,1. used to say that something is possible 2. used to ask for or give permission
media,noun,"the main ways that large numbers of people receive information and entertainment, that is television, radio, newspapers and the internet"
medical,adjective,1. connected with illness and injury and their treatment 2. connected with ways of treating illness that do not involve cutting the body
medicine,noun,"1. the study and treatment of diseases and injuries 2. a substance that you take in order to cure an illness, especially a liquid that you drink or swallow"
memory,noun,1. your ability to remember things 2. the period of time that a person or group of people is able to remember events
mention,verb,"1. to write or speak about something/somebody, especially without giving much information 2. to refer to somebody/something as being interesting, especially as a possible candidate for a job or position"
metal,noun,"1. a type of solid mineral substance that is usually hard and shiny and that heat and electricity can travel through, for example tin, iron and gold 2. (to go) at full speed; (to drive) with the accelerator of the car pressed to the floor"
method,noun,1. a particular way of doing something 2. the quality of being well planned and organized
metro,noun,"1. an underground train system, especially the one in Paris 2. a large or capital city, especially Delhi, Kolkata, Mumbai or Chennai"
middle,adjective,"1. in a position in the middle of an object, group of objects, people, etc.; between the beginning and the end of something 2. (to take/find) an acceptable course of action that avoids two extreme positions"
middle,noun,1. the part of something that is at an equal distance from all its edges or sides; a point or a period of time between the beginning and the end of something 2. a person’s waist
might,verb,1. used when showing that something is or was possible 2. used as the past tense of may when reporting what somebody has said
mind,verb,"1. to be upset, annoyed or worried by something 2. used to ask for permission to do something, or to ask somebody in a polite way to do something"
mind,noun,"1. the part of a person that makes them able to be aware of things, to think and to feel 2. your ability to think and reason; your intelligence; the particular way that somebody thinks"
mine,noun,1. of or belonging to the person writing or speaking 2. my home
mirror,noun,"1. a piece of special flat glass that reflects images, so that you can see yourself when you look in it 2. something that shows what something else is like"
miss,verb,1. to be or arrive too late for something 2. to fail to be or go somewhere
missing,adjective,"1. that cannot be found or that is not in its usual place; that has been removed, lost or destroyed 2. not at home; not found"
mobile,adjective,"1. connected with mobile phones, tablets, etc. 2. that is not fixed in one place and can be moved easily and quickly"
mobile,noun,1. a mobile phone 2. the internet when it is accessed on mobile phones
modal,noun,"a verb such as can, may or will that is used with another verb (not a modal) to express possibility, permission, intention, etc."
model,noun,"1. a copy of something, usually smaller than the original object 2. something such as a text or a system that can be used as an example for other people to copy"
momma,noun,a child’s word for a mother
mommy,noun,a child’s word for a mother
monkey,noun,"1. an animal with a long tail, that climbs trees and lives in hot countries. There are several types of monkey and they are related to apes and humans. 2. a child who is active and likes playing tricks on people"
moon,noun,1. the round object that moves around the earth once every 27½ days and shines at night by light reflected from the sun 2. the moon as it appears in the sky at a particular time
mostly,adverb,mainly; generally
motorbike,noun,"1. a road vehicle with two wheels, driven by an engine, with one seat for the driver and often a seat for a passenger behind the driver 2. a bicycle that has a small engine"
motorcycle,noun,"a road vehicle with two wheels, driven by an engine, with one seat for the driver and often a seat for a passenger behind the driver"
motorway,noun,"(in the UK) a wide road, with at least two lanes in each direction, where traffic can travel fast for long distances between large towns. You can only enter and leave motorways at special junctions."
move,verb,"1. to change position or make somebody/something change position in a way that can be seen, heard or felt 2. to change the place where you live, have your work, etc."
movement,noun,1. an act of moving the body or part of the body 2. an act of moving from one place to another or of moving something from one place to another
mummy,noun,1. a child’s word for a mother 2. a body of a human or an animal that has been mummified
mushroom,noun,a fungus with a round flat head and short stem. Many mushrooms can be eaten.
music,noun,1. sounds that are arranged in a way that is pleasant or exciting to listen to. People sing music or play it on instruments. 2. the art of writing or playing music
musical,adjective,1. connected with music; containing music 2. with a natural skill or interest in music
musician,noun,"a person who plays a musical instrument or writes music, especially as a job"
myself,noun,1. used when the speaker or writer is also the person affected by an action 2. used to emphasize the fact that the speaker is doing something
name,noun,"1. a word or words that a particular person, animal, place or thing is known by 2. a reputation that somebody/something has; the opinion that people have about somebody/something"
narrow,adjective,"1. measuring a short distance from one side to the other, especially in relation to length 2. only just achieved or avoided"
national,adjective,"1. connected with a particular nation; shared by a whole nation 2. owned, controlled or paid for by the government"
nature,noun,"1. all the plants, animals and things that exist in the universe that are not made by people 2. the way that things happen in the physical world when it is not controlled by people"
nearly,adverb,1. almost; not quite; not completely 2. much less than; not at all
necessary,adjective,1. that is needed for a purpose or a reason 2. that must exist or happen and cannot be avoided
neck,noun,1. the part of the body between the head and the shoulders 2. the part of a piece of clothing that fits around the neck
necktie,noun,"a long narrow piece of cloth worn around the neck, especially by men, with a knot in front"
need,noun,1. a situation when something is necessary or must be done 2. a strong feeling that you want somebody/something or must have something
neither,noun,not one nor the other of two things or people
nephew,noun,the son of your brother or sister; the son of your husband’s or wife’s brother or sister
nervous,adjective,1. anxious about something or afraid of something 2. easily worried or frightened
net,noun,"1. material that is made of string, thread or wire twisted or tied together, with small spaces in between; a piece of this material used for a particular purpose 2. the frame covered in net that forms the goal"
network,noun,"1. a complicated system of roads, lines, tubes, nerves, etc. that are connected to each other and operate together 2. a closely connected group of people, companies, etc. that exchange information, etc."
networking,noun,a system of trying to meet and talk to other people who may be useful to you in your work
niece,noun,the daughter of your brother or sister; the daughter of your husband’s or wife’s brother or sister
noise,noun,"1. a sound, especially when it is loud, unpleasant or frightening 2. extra electrical or electronic signals that are not part of the signal that is being broadcast or transmitted and which may damage it"
