english,tag,definition
electricity,noun,"1. a form of energy from charged elementary particles, usually supplied as electric current through cables, wires, etc. for lighting, heating, driving machines, etc. 2. a feeling of great emotion, excitement, etc."
electronic,adjective,"1. having or using many small parts, such as microchips, that control and direct a small electric current 2. done or produced by means of a computer or other electronic device"
employ,verb,"1. to give somebody a job to do for payment 2. to use something such as a skill, method, etc. for a particular purpose"
employee,noun,a person who is paid to work for somebody
employer,noun,a person or company that pays people to work for them
empty,adjective,1. with no people or things inside 2. with no meaning; not meaning what is said
end,noun,"1. the final part of a period of time, an event, an activity or a story 2. a situation in which something does not exist any more"
ending,noun,"1. the last part of a story, film, etc. 2. the act of finishing something; the last part of something"
energy,noun,"1. the strength, effort and enthusiasm required for physical or mental activity, work, etc. 2. the physical and mental effort that you use to do something"
engine,noun,1. the part of a vehicle that produces power to make the vehicle move 2. a thing that has an important role in making a particular process happen
engineer,noun,"1. a person whose job involves designing and building engines, machines, roads, bridges, etc. 2. a person who is trained to repair machines and electrical equipment"
enjoy,verb,1. to get pleasure from something 2. to be happy and get pleasure from what you are doing
enormous,adjective,extremely large
enter,verb,"1. to come or go into something 2. to put your name on the list for an exam, a race, a competition, etc.; to do this for somebody"
environment,noun,"1. the natural world in which people, animals and plants live 2. the conditions in which a person, animal or plant lives or operates or in which an activity takes place"
equipment,noun,1. the things that are needed for a particular purpose or activity 2. the process of providing a place or person with necessary things
error,noun,"1. a mistake, especially one that causes problems or affects the result of something 2. to realize or admit that you have done something wrong and decide to change your behaviour"
especially,adverb,"1. more with one person, thing, etc. than with others, or more in particular circumstances than in others  2. for a particular purpose, person, etc."
essay,noun,"1. a short piece of writing by a student as part of a course of study 2. a short piece of writing on a particular subject, written in order to be published"
everyday,adjective,used or happening every day or regularly; ordinary
everywhere,adverb,"in, to or at every place; all places"
evidence,noun,"1. the facts, signs or objects that make you believe that something is true 2. the information that is used in court to try to prove something"
exact,adjective,1. correct in every detail 2. very accurate and careful about details
exactly,adverb,1. used to emphasize that something is correct in every way or in every detail 2. used to ask for more information about something
excellent,adjective,1. extremely good 2. used to show that you are very pleased about something or that you approve of something
except,preposition,used before you mention the only thing or person about which a statement is not true
exist,verb,"1. to be real; to be present in a place or situation 2. to live, especially in a difficult situation or with very little money"
expect,verb,"1. to think or believe that something will happen or that somebody will do something 2. to be waiting for somebody/something to arrive, as this has been arranged"
experience,noun,1. the knowledge and skill that you have gained through doing something for a period of time; the process of gaining this 2. the things that have happened to you that influence the way you think and behave
experiment,noun,"1. a scientific test that is done in order to study what happens and to gain new knowledge 2. a new activity, idea or method that you try out to see what happens or what effect it has"
expert,noun,"a person with special knowledge, skill or training in something"
expert,adjective,"done with, having or involving great knowledge or skill"
explanation,noun,"1. a statement, fact, or situation that tells you why something happened; a reason given for something 2. a statement or piece of writing that tells you how something works or makes something easier to understand"
express,verb,"1. to show or make known a feeling, an opinion, etc. by words, looks or actions 2. to speak, write or communicate in some other way what you think or feel"
expression,noun,"1. a word or phrase 2. things that people say, write or do in order to show their feelings, opinions and ideas"
extreme,adjective,1. very great in degree 2. not ordinary or usual; serious or severe
extremely,adverb,to a very high degree
factor,noun,1. one of several things that cause or influence something 2. a number that divides into another number exactly
factory,noun,"1. a building or group of buildings where goods are made, mainly by machine 2. a person or organization that continuously produces a large quantity of a particular thing"
fail,verb,1. to not be successful in achieving something 2. to not pass a test or an exam; to decide that somebody/something has not passed a test or an exam
fair,adjective,1. acceptable and appropriate in a particular situation 2. treating everyone equally and according to the rules or law
fall,noun,"1. an act of falling 2. an amount of snow, rain, rocks, etc. that falls or has fallen"
fall,verb,1. to drop down from a higher level to a lower level 2. to suddenly stop standing
family,noun,"1. a group consisting of one or two parents and their children 2. a group consisting of one or two parents, their children and close relations"
fan,noun,1. a person who admires somebody/something or enjoys watching or listening to somebody/something very much 2. a machine that creates a current of air
farm,verb,1. to use land for growing crops and/or keeping animals 2. to keep fish or birds in order to produce young and sell them for food 
farming,noun,the business of managing or working on a farm
fashion,noun,"1. a popular style of clothes, hair, etc. at a particular time or place; the state of being popular 2. the business of making or selling clothes in new and different styles"
fat,noun,"1. a white or yellow substance in the bodies of animals and humans, stored under the skin 2. a solid or liquid substance from animals or plants, treated so that it becomes pure for use in cooking"
fear,noun,1. the bad feeling that you have when you are in danger or when a particular thing frightens you 2. a feeling of concern about somebody's safety or about something bad that might happen
feature,noun,"1. something important, interesting or typical of a place or thing 2. a part of somebody’s face such as their nose, mouth and eyes"
feed,verb,1. to give food to a person or an animal 2. to eat food
feel,verb,1. to experience a particular feeling or emotion 2. to notice or be aware of something because it is touching you or having a physical effect on you
feeling,noun,1. something that you feel through the mind or through the senses 2. a person’s emotions rather than their thoughts or ideas
female,noun,1. an animal that can lay eggs or give birth to babies; a plant that can produce fruit 2. a woman or a girl
female,adjective,1. being a woman or a girl 2. belonging to the sex that can lay eggs or give birth to babies
festival,noun,"1. a series of performances of music, plays, films, etc., usually organized in the same place once a year; a series of public events connected with a particular activity or idea 2. a day or period of the year when people stop working to celebrate a special event, often a religious one"
fiction,noun,"1. a type of literature that describes imaginary people and events, not real ones 2. a thing that is invented or imagined and is not true"
field,noun,"1. an area of land in the country used for growing crops or keeping animals in, usually surrounded by a fence, etc. 2. an area of land used for the purpose mentioned"
fight,verb,1. to take part in a war or battle against an enemy 2. to struggle physically with somebody
fight,noun,"1. a struggle against somebody/something using physical force 2. an occasion when people fight as a sport, especially in boxing"
figure,noun,"1. a number representing a particular amount, especially one given in official information 2. a symbol rather than a word representing one of the numbers between 0 and 9"
film,verb,to make a film of a story or a real event; to record somebody/something on film
final,noun,"1. the last of a series of games or competitions, in which the winner is decided 2. a series of games or performances that make up the last stage of a competition"
finally,adverb,"1. after a long time, especially when there has been some difficulty or delay 2. used to introduce the last in a list of things"
find,verb,1. to discover somebody/something unexpectedly or by chance 2. to get back something/somebody that was lost after searching for it/them
finger,noun,"1. one of the four long thin parts that stick out from the hand (or five, if the thumb is included) 2. having the type of fingers mentioned; having or using the number of fingers mentioned"
finish,noun,1. the last part or the end of something 2. the position in which a person or team finishes a competition
first,noun,happening or coming before all other similar things or people; 1st
firstly,adverb,used to introduce the first of a list of points you want to make in a speech or piece of writing
fish,verb,"1. to try to catch fish with nets, a fishing line, etc. 2. to spend time fishing for pleasure"
fishing,noun,the sport or business of catching fish
fit,verb,"1. to be the right shape and size for somebody/something 2. to be of the right size, type or number to go somewhere"
fit,adjective,"1. healthy and strong, especially because you do regular physical exercise 2. suitable; of the right quality; with the right qualities or skills"
fix,verb,"1. to repair or correct something 2. to decide on a date, a time, an amount, etc. for something"
flat,adjective,"1. having a level surface, not curved or sloping, and without holes or any bits sticking out 2. without any slopes or hills"
floor,noun,1. the surface of a room that you walk on 2. the bottom surface of a vehicle
flu,noun,"a serious disease caused by a virus, that causes a high temperature, severe pains and weakness"
fly,noun,"1. a small flying insect with two wings. There are many different types of fly and many of them spread disease. 2. a fly or something made to look like a fly, that is put on the end of a fishing line and used as bait to catch fish"
flying,adjective,1. able to fly 2. moving rapidly through the air
flying,noun,1. travelling in an aircraft 2. operating the controls of an aircraft
focus,verb,"1. to give attention, effort, etc. to one particular subject, situation or person rather than another 2. to adapt or be changed so that things can be seen clearly; to change something so that you can see things clearly"
focus,noun,1. the thing or person that people are most interested in; the act of paying special attention to something and making people interested in it 2. a point or distance at which the outline of an object is clearly seen by the eye or through a lens
follow,verb,1. to come or go after or behind somebody/something 2. to come or go after or behind somebody in order to watch where they go and what they do
following,adjective,1. that is/are going to be mentioned next 2. next in time
food,noun,1. things that people or animals eat 2. an idea that makes you think seriously and carefully
foot,noun,"1. the lowest part of the leg, below the ankle, on which a person or an animal stands 2. having or using the type or number of foot/feet mentioned"
football,noun,"1. a game played by two teams of 11 players, using a round ball that players kick up and down the playing field. Teams try to kick the ball into the other team’s goal. 2. a game played by two teams of 11 players, using an oval ball which players kick, throw, or carry. Teams try to put the ball over the other team’s line."
foreign,adjective,1. in or from a country that is not your own 2. dealing with or involving other countries
forest,noun,1. a large area of land that is thickly covered with trees 2. a mass of tall narrow objects that are close together
fork,noun,"1. a tool with a handle and three or four sharp points (called prongs), used for picking up and eating food 2. a garden tool with a long or short handle and three or four sharp metal points, used for digging"
formal,adjective,1. very correct and suitable for official or important occasions 2. official; following an agreed or official way of doing things
fortunately,adverb,by good luck
forward,adverb,1. towards a place or position that is in front 2. towards the future; ahead in time
free,adjective,1. without particular plans or arrangements; not busy 2. not being used
free,adverb,1. without payment 2. in a way that is not tied but is able to move about
fresh,adjective,"1. recently produced or picked and not frozen, dried or preserved in tins or cans 2. pleasantly clean, pure or cool"
fridge,noun,a piece of electrical equipment in which food is kept cold so that it stays fresh
friend,noun,"1. a person you know well and like, and who is not usually a member of your family 2. a person who is on your list of contacts on a social media website"
frog,noun,"1. a small animal with smooth skin, that lives both on land and in water (= is an amphibian). Frogs have very long back legs for jumping, and no tail. 2. an offensive word for a French person"
front-page,adjective,"appearing on the front page of a newspaper, where the most important news is printed"
fun,adjective,1. that you enjoy 2. that provides entertainment or leisure activities
furniture,noun,"1. objects that can be moved, such as tables, chairs and beds, that are put into a house or an office to make it suitable for living or working in 2. a person or thing that you are so used to seeing that you no longer notice them"
further,adjective,more; additional
future,adjective,taking place or existing at a time after the present
g,abbreviation,gram(s)
gallery,noun,"1. a room or building for showing works of art, especially to the public 2. a collection of pictures"
game,noun,"1. an activity that you do to have fun, often one that has rules and that you can win or lose; the equipment for a game 2. a sport with rules in which people or teams compete against each other"
gap,noun,"1. a space where something is missing 2. a space between two things or in the middle of something, especially because there is a part missing"
garbage,noun,"1. waste food, paper, etc. that you throw away 2. a place or container where waste food, paper, etc. can be placed"
gas,noun,"1. any substance like air that is neither a solid nor a liquid, for example hydrogen or oxygen 2. a particular type of gas or mixture of gases used as fuel for heating and cooking"
gate,noun,1. a barrier like a door that is used to close an opening in a fence or a wall outside a building 2. an opening that can be closed by a gate or gates
general,adjective,"1. affecting all or most people, places or things 2. normal; usual"
gift,noun,"1. a thing that you give to somebody, especially on a special occasion or to say thank you 2. a natural ability"
go,verb,"1. to move or travel from one place to another 2. to move or travel, especially with somebody else, to a particular place or in order to be present at an event"
goal,noun,1. a frame with a net into which players must kick or hit the ball in order to score a point 2. the act of kicking or hitting the ball into the goal; a point that is scored for this
god,noun,1. the being or spirit that is worshipped and is believed to have created the universe 2. (in some religions) a being or spirit who is believed to have power over a particular part of nature or who is believed to represent a particular quality
gold,noun,"1. a chemical element. Gold is a yellow precious metal used for making coins, jewellery, beautiful objects, etc. 2. money, jewellery, etc. that is made of gold"
gold,adjective,"bright yellow in colour, like gold"
golf,noun,"a game played over a large area of ground using sticks with a special shape to hit a small hard ball (a golf ball) into a series of 9 or 18 holes, using as few shots as possible"
good,noun,1. behaviour that is morally right or acceptable 2. people who live a moral life; people who are admired for the work they do to help other people
good-looking,adjective,physically attractive
government,noun,1. the group of people who are responsible for controlling a country or a state 2. a particular system or method of controlling a country
granny,noun,grandmother
grass,noun,"1. a common wild plant with narrow green leaves and stems that are eaten by cows, horses, sheep, etc. 2. any type of grass"
gray,adjective,1. having the colour of smoke or ashes 2. not bright; full of clouds
greet,verb,1. to say hello to somebody or to welcome them 2. to react to somebody/something in a particular way
grey,adjective,1. having the colour of smoke or ashes 2. not bright; full of clouds
ground,noun,"1. the solid surface of the earth 2. used to describe activities that take place on the ground, not in the air or at sea"
guest,noun,"1. a person that you have invited to your house or to a particular event that you are paying for 2. a person who is staying at a hotel, etc."
guide,noun,"1. a person who shows other people the way to a place, especially somebody employed to show tourists around interesting places 2. a person who advises you on how to live and behave"
guide,verb,"1. to show somebody the way to a place, often by going with them; to show somebody a place that you know well 2. to direct or influence somebody’s behaviour or the development of something"
guitarist,noun,a person who plays the guitar
gun,noun,1. a weapon that is used for firing bullets or shells 2. a tool that uses pressure to send out a substance or an object
guy,noun,1. a man 2. a group of people of either sex
habit,noun,"1. a thing that you do often and almost without thinking, especially something that is hard to stop doing 2. usual behaviour"
hairbrush,noun,a brush for making the hair tidy or smooth
hairdresser,noun,"1. a person whose job is to cut, wash and shape hair 2. a place where you can get your hair cut, washed and shaped"
half,adverb,1. to the extent of half 2. partly
hall,noun,1. a space or passage inside the entrance or front door of a building 2. a passage in a building with rooms down either side
hallway,noun,1. a space or passage inside the entrance or front door of a building 2. a passage in a building with rooms down either side
hamburger,noun,"1. beef cut into small pieces and made into a flat round shape that is then fried, often served in a bread roll 2. beef that has been cut very small in a special machine"
handbag,noun,"a small bag for money, keys, etc., especially one carried by a woman"
handsome,adjective,"1. attractive 2. attractive, with large strong features rather than small light ones"
happily,adverb,1. in a cheerful way; with feelings of pleasure 2. by good luck
hard-working,adjective,putting a lot of effort into a job and doing it well
have,verb,"1. to own, hold or possess something 2. be made up of"
head,noun,"1. the part of the body on top of the neck containing the eyes, nose, mouth and brain 2. the mind or brain"
headache,noun,1. a continuous pain in the head 2. a person or thing that causes worry or trouble
heart,noun,"1. the organ in the chest that sends blood around the body, usually on the left in humans 2. the outside part of the chest where the heart is"
heat,noun,1. the quality of being hot 2. heat seen as a form of energy that is transferred from one object or substance to another as a result of a difference in temperature 
heat,verb,to make something hot or warm; to become hot or warm
heavy,adjective,"1. weighing a lot; difficult to lift or move 2. more or worse than usual in amount, degree, etc."
height,noun,1. the measurement of how tall a person or thing is 2. the quality of being tall or high
help,noun,1. the act of helping somebody to do something 2. the act of helping somebody who is in danger
helpful,adjective,1. able to improve a particular situation 2. willing to help somebody
hero,noun,"1. a person who is admired by many people for doing something brave or good 2. the main male character in a story, novel, film, etc."
heroine,noun,"1. a girl or woman who is admired by many for doing something brave or good 2. the main female character in a story, novel, film, etc."
hers,noun,of or belonging to her
herself,noun,1. used when the woman or girl who performs an action is also affected by it 2. used to emphasize the female subject or object of a sentence
hide,verb,1. to put or keep somebody/something in a place where they/it cannot be seen or found 2. to go somewhere where you hope you will not be seen or found
hide,noun,"1. a place from which people can watch wild animals or birds, without being seen by them 2. an animal’s skin, especially when it is bought or sold or used for leather"
high,adverb,"1. at or to a position or level that is a long way up from the ground or from the bottom 2. at or to a large value, amount or price"
hike,noun,"1. a long walk in the country 2. a large or sudden increase in prices, costs, etc."
hike,verb,"1. to go for a long walk in the country, especially for pleasure 2. to spend time hiking for pleasure"
hiking,noun,the activity of going for long walks in the country for pleasure
hill,noun,"1. an area of land that is higher than the land around it, but not as high as a mountain 2. a slope on a road"
himself,noun,1. used when the man or boy who performs an action is also affected by it 2. used to emphasize the male subject or object of a sentence
his,noun,of or belonging to a man or boy who has already been mentioned or is easily identified
hit,verb,"1. to bring your hand, or an object you are holding, against somebody/something quickly and with force 2. to come against something/somebody with force, especially causing damage or injury"
hit,noun,"1. an act of hitting somebody/something with your hand or with an object held in your hand 2. an occasion when something that has been thrown, fired, etc. at an object reaches that object; the fact of being hit by something"
hockey,noun,"1. a game played on a field by two teams of 11 players, with curved sticks and a small hard ball. Teams try to hit the ball into the other team’s goal. 2. a game played on ice, in which players use long sticks to hit a hard rubber disc (called a puck) into the other team’s goal"
hold,verb,"1. to have somebody/something in your hand, arms, etc. 2. to put your hand on part of your body, usually because it hurts"
hole,noun,1. a hollow space in something solid or in the surface of something 2. a space or opening that goes all the way through something
holiday,noun,1. a period of time when you are not at work or school 2. a period of time spent travelling or resting away from home
home,adjective,1. connected with the place where you live 2. made or used at home
home,noun,"1. the house or flat that you live in, especially with your family 2. a house or flat, etc., when you think of it as property that can be bought and sold"
hope,noun,1. a feeling of wanting and expecting a particular thing to happen; something that you wish for 2. a reason to believe that something good may happen
hotlink,noun,a place in an electronic document that is connected to another electronic document or to another part of the same document
housework,noun,"the work involved in taking care of a home and family, for example cleaning and cooking"
huge,adjective,1. extremely large in size or amount; great in degree 2. very successful
human,noun,a person rather than an animal or a machine
human,adjective,"1. of or connected with people rather than animals, machines or gods 2. showing the weaknesses and desires that are typical of people, which means that other people should not criticize the person too much"
hurt,verb,1. to cause physical pain to somebody/yourself; to injure somebody/yourself 2. to feel painful
hurt,adjective,1. injured physically 2. upset and offended by something that somebody has said or done
hyperlink,noun,a place in an electronic document that is connected to another electronic document or to another part of the same document
idea,noun,"1. a plan, thought or suggestion, especially about what to do in a particular situation 2. a picture or an impression in your mind of what somebody/something is like"
ideal,adjective,1. perfect; most suitable 2. existing only in your imagination or as an idea; not likely to be real
identify,verb,1. to recognize somebody/something and be able to say who or what they are 2. to find or discover somebody/something
ill,adjective,1. suffering from an illness or disease; not feeling well 2. bad or harmful
illness,noun,1. the state of being physically or mentally ill 2. a type or period of illness
image,noun,"1. a picture, photograph or statue that represents somebody/something 2. a picture of somebody/something seen in a mirror, through a camera, or on a television, computer, phone, etc."
immediately,adverb,1. without delay 2. next to or very close to a particular place or time
impossible,adjective,1. that cannot exist or be done; not possible 2. very difficult to deal with
